[
  {
    "id": "2026-07-04T12:03:48.055Z-5231",
    "ts": 1783166934187,
    "nudges": 1,
    "blocks": 0,
    "bypasses": 0
  },
  {
    "id": "2026-07-04T12:47:08.375Z-34968",
    "ts": 1783169952166,
    "nudges": 1,
    "blocks": 1,
    "bypasses": 1
  },
  {
    "id": "2026-07-04T15:36:57.878Z-46476",
    "ts": 1783180680627,
    "nudges": 1,
    "blocks": 1,
    "bypasses": 0
  }
]